{
  "spec_version": "1.0.0",
  "kind": "manifest_diff",
  "old_manifest_id": "amf_01KZWEB6G8P3XE7ZQ3MQ06ZK3C",
  "new_manifest_id": "amf_01KZWEB6GAKHYPA3F40MXTXG21",
  "changed_surfaces": [
    {
      "surface": "environment",
      "change_type": "non_breaking",
      "severity": "moderate",
      "details": [
        "region: 'us-east-1' \u2192 'eu-west-1'"
      ]
    }
  ],
  "summary": {
    "breaking_surfaces": 0,
    "non_breaking_surfaces": 1,
    "max_severity": "moderate"
  }
}
