{
  "spec_version": "1.0.0",
  "kind": "manifest_diff",
  "old_manifest_id": "amf_01KZWEB6GJE35JBC9RVANRTG8N",
  "new_manifest_id": "amf_01KZWEB6GMW2M7YPH5TRC8GC04",
  "changed_surfaces": [
    {
      "surface": "output_contract",
      "change_type": "breaking",
      "severity": "moderate",
      "details": [
        "format: 'text' \u2192 'json'",
        "output schema changed"
      ]
    }
  ],
  "summary": {
    "breaking_surfaces": 1,
    "non_breaking_surfaces": 0,
    "max_severity": "moderate"
  }
}