{
  "spec_version": "1.0.0",
  "kind": "manifest_diff",
  "old_manifest_id": "amf_01KZWEB6GDSZ28WY3ES5Q6TPAR",
  "new_manifest_id": "amf_01KZWEB6GFD65WN85WYQREF3K9",
  "changed_surfaces": [
    {
      "surface": "model_runtime",
      "change_type": "breaking",
      "severity": "major",
      "details": [
        "provider: 'openai' \u2192 'anthropic'"
      ]
    }
  ],
  "summary": {
    "breaking_surfaces": 1,
    "non_breaking_surfaces": 0,
    "max_severity": "major"
  }
}
