{
  "spec_version": "1.0.0",
  "kind": "manifest_diff",
  "old_manifest_id": "amf_01KZWEB6H6B50N1EYNVFGTXM1T",
  "new_manifest_id": "amf_01KZWEB6H8AHE7V9SEY53NJPJ3",
  "changed_surfaces": [
    {
      "surface": "tool_registry",
      "change_type": "breaking",
      "severity": "major",
      "details": [
        "search_population removed",
        "get_population added"
      ]
    }
  ],
  "summary": {
    "breaking_surfaces": 1,
    "non_breaking_surfaces": 0,
    "max_severity": "major"
  }
}