{
  "spec_version": "1.0.0",
  "kind": "manifest_diff",
  "old_manifest_id": "amf_01KZWEB6GWT65RGD028TXQ95R3",
  "new_manifest_id": "amf_01KZWEB6GYKNWDSVC0H03QAKY6",
  "changed_surfaces": [
    {
      "surface": "skill_registry",
      "change_type": "breaking",
      "severity": "moderate",
      "details": [
        "translate removed"
      ]
    }
  ],
  "summary": {
    "breaking_surfaces": 1,
    "non_breaking_surfaces": 0,
    "max_severity": "moderate"
  }
}
